kode_rs,nama_rs,alamat_rs,telepon_rs
3307050,RS Umum Islam Wonosobo,Jl. Letjen S. Parman Km.3 Wonosobo,0286-325250
3308014,RS Umum Daerah Muntilan Kab. Magelang,Jl. Kartini No.13 Muntilan,0293-587004
3309015,RS Umum Daerah Pandan Arang Boyolali,Jl. Kantil No. 14 Boyolali,0276-321065
3309041,RS Umum Dr. Oen Sawit,"Dk. Tegalarum, Ds. Kateguhan, Kec. Sawit, Kab. Boyolali",(0271) 782420
3309063,RS Umum PKU Aisyiyah Boyolali,Jl. Pasar Sapi Baru Singkil - Karanggeneng - Boyolali,(0276) 322898
3309074,RS Umum Umi Barokah,"Jl.Prof.DR.Soeharso No.6 Tegal Rejo,Boyolali",(0276)321452
3309085,RS Umum  Karanggede Sisma Medika,"Jl. Raya Karanggede - Solo KM.1, Boyolali",0298-610600
3309096, RS Umum Daerah Waras Wiris,Jl. Raya Karanggede - Gemolong Km. 13 Andong Kab.Boyolali,081575290555
3309107, RS Umum Daerah Simo,"Jl. Kebon Ijo Ds.Simo Kec.Simo, Boyolali",0276-3294719
3310015,RS Umum Pusat Dr. Soeradji Tirtonegoro,"Jl. KRT. dr. Soeradji Tirtonegoro No.1, Klaten",0272-321020
3310026,RS Jiwa Daerah Dr. RM. Soedjarwadi,"Jalan Ki Pandanaran Km. 2, Klaten",0272-321435
3310052, RS Ibu dan Anak Aisyiah,"Jl. KH. Hasyim Ashari, Mojayan, Klaten",320566
3310384,RS Umum Islam Klaten,"Jl. Raya Klaten Solo KM 4,Klaten",0272-322252
3310395,RS Umum Cakra Husada,"Jl. Merbabu No. 7,Klaten",(0272) 321123
3310405, RS Khusus Bedah Diponegoro,"Jl. Diponegoro No.21,Klaten",0272-325127
3311016,RS Umum Daerah Ir. Soekarno Kabupaten Sukoharjo,"Jl. Dr. Muwardi 71, Sukoharjo",0271-593118
3311213, RS Umum Nirmala Suri,"Jl. Raya Solo Sukoharjo Km.9, Sukoharjo",0271 - 592192
3311224,RS Umum Dr. Oen Solo Baru,Komplek Perumahan Solo Baru Kec.Grogol Sukoharjo,0271-620220
3312010, RS Umum Daerah Dr. Soediran Mangun Sumarso Wonogi,"Jl. Jend A Yani No. 40,Giriwono, Wonogiri, Jateng",0273-321008
3312273, RS Umum Marga Husada,"Jl. Letjen S.Parman No. 4 Selogiri,Wonogiri",0273321394
3312284,RS Umum Muhammadiyah Selogiri,"Jl. Lama Bulak, RT.02, RW.04 Desa Nambangan Selogiri, Wonogiri",0273322624
3312295,RS Umum Medika Mulya,"Jl. Raya Wonogiri-Ngadirojo KM.5,Wonogiri",0273-5327365
3312306,RS Umum  Amal Sehat,"Jl. Ngerjopuro RT.02/RW.03,Slogohimo Wonogiri",0273-5316677
3313011, RS Umum Daerah Karanganyar,Jl. Laksda Yos Sudarso Karanganyar,0271-495673
3313022,RS Umum Lanuma Adisumarmo,"Jl. Tentara Pelajar - Colomadu, Karanganyar",0271-780050
3313033,RS Umum PKU Muhammadiyah Karang Anyar,Jl. Raya Papahan Ds. Papahan Kec. Tasikmadu Karanganyar,0271494019
3314012,RS Umum Daerah dr. Soehadi Prijonegoro,"Jl. Raya Sukowati No.534, Sragen",0271 891068
3314023,RS Umum Mardi Lestari Sragen,"Jl. Rokan No.8,Sragen",0271-891033
3314045, RS Umum Sarila Husada,"Jl. Veteran No. 41-43,Sragen",0271-891538
3314056, RS Umum Islam Amal Sehat Sragen,"Jl. Veteran No.35, Sragen, Jawa Tengah",0271-891977
3314067,RS Umum Assalam,"Jl. Gatot Subroto KM.1,5 Kulon Palang Gemolong",0271-6811269
3315013, RS Umum Daerah Dr. R.Soedjati Soemodiardjo,"Jl. D.I Panjaitan 36,Purwodadi - Grobogan 58111",0292-421004
3315024,RS Umum Panti Rahayu,"Jl. R Suprapto No.6,Purwodadi",0292-421087
3315035, RS Umum Permata Bunda,"Jl. Hayam Wuruk No. 24, Purwodadi, Grobogan",0292-422838
3315046,RS Umum Muhammadiyah Gubug,Jl. Letjen R Soeprapto No.12 Gubug,0292 533102
3315057, RS Umum Habibullah,Jl. Raya Tahunan Kec.Gabus Kab.Grobogan,(0292)5160447
3316014,RS Umum Daerah Dr. R. Soetijono Blora,"Jl. Dr Sutomo No. 42,Blora Jawa Tengah",0296-531118
3316025,RS Umum Daerah Dr. R. Soeprapto Cepu,"Jl. Ronggolawe No. 50,Cepu",0296-421026
3316040,RS Umum Permata Blora,"Jl. Reksodiputro No.57,Blora",0296 531624
3316051,RS Umum PKU Muhammadiyah Cepu,"Jl. Ronggolawe No.137,Cepu",0296-421727
3316062,RS Umum Bantuan Blora,"Jl. Dr. Sutomo No.45, Blora",(0296) 531041
3317015, RS Umum Daerah dr. R. Soetrasno Rembang,"Jl. Pahlawan No.16,Rembang",0295-691444
3318016,RS Umum Daerah RAA Soewondo,Jl. Dr Soesanto  No. 114,0295-381102
3318064,RS Umum Islam Pati,Jl. Raya Pati-Tayu KM.18Waturoyo Margoyoso Pati,0295 452316
3318075,RS Umum Mitra Bangsa Pati,"Jl. Kol.Sugiyono No.75,Pati",382555
3318086, RS Umum Daerah Kayen Pati,Jl. Rumah Sakit No.1 Kayen Pati,(0295)4101294
3318097,RS Umum Bantuan Pati,Jl. P. Sudirman No.77 Pati,0295382684
3319010,RS Umum Daerah dr. Loekmono Hadi,"Jl. Dr. Lukmonohadi No.19,Kudus",0291-444001
3319032,RS Umum Mardi Rahayu,"Jl. AKBP R Agil 110,Kudus",0291- 434707-10
3319080, RS Umum  Islam Sunan Kudus,"Jl. Kudus Permai No.1, Kaliwungu, Kudus",0291432008
3319091,RS Ibu dan Anak Permata Hati,"Jl. Nisemito No.28,Kudus",0291-439187
3319102, RS Umum Bantuan Kudus,"Jl. Jend. Sudirman No.64, Kudus",0291-432532
3320010,RS Umum Daerah R. A. Kartini,Jl. K.H. Wahid Hasyim Jepara,0291-593286
3320021,RS Umum Daerah Kelet Provinsi Jawa Tengah,Jl. Raya Kelet KM 33 Jepara,0291-579002
3320032,RS Umum Sultan Hadlirin Jepara,"Jl. Jepara-Bangsri KM.3, Kuwasen, Jepara",(0291) 591507
3320043,RS Umum Graha Husada,"Jl. MH.Thamrin No.14,Jepara",0291592067
3321011,RS Umum Daerah Sunan Kalijaga,"Jl. Sultan Fatah No. 669/50,Demak",0291 685018
3321033,RS Umum Islam NU Demak,"Jl. Jogoloyo No.9, Kec. Wonosalam, Demak",0291685723
3322012, RS Umum Daerah Ambarawa,"Jl. Kartini No.101, Ambarawa",0298-591020
3322023, RS Umum Daerah Ungaran,"Jl. Diponegoro 125,Ungaran",024-6921006
3322071, RS Umum Bina Kasih,Jl. Naryo Atmajan 27 Ambarawa,(0298) 591280
3323013, RS Umum Daerah Djojonegoro Temanggung,Jl.GAJAHMADA 1A,0293-491119
3323024,RS Umum Ngesti Waluyo,"Jl. Pahlawan Parakan,Temanggung",0293 596008
3323046,RS Umum Gunung Sawo Kab. Temanggung,"Jl. Gatot Subroto Km. 2, Manding Temanggung",0293-4903003
3323050,RS Umum PKU Muhammadiyah Temanggung,"Jl. Raya Kedu Km.2,Temanggung",0293596704
3324014,RS Umum Daerah  Dr. H. Soewondo Kendal,"Jl. Laut No. 21, Kendal",381433
3324036,RS Umum Islam Kendal,"Jl. Ar.Rahmah No.17 Ds. Ngasinan, Weleri,Kendal",0294641870
3325015,RS Umum Daerah Kab. Batang,Jl. Dr Sutomo No. 42 Batang,0285-391033
3325026, RS Umum Bhakti Waluyo,Jl.Dr.Sutomo No. 32,(0285) 423623
3326016,RS Umum Islam PKU Muhammadiyah Pekajangan,"Jl. Raya Ambokembang No.42-44,Pekalongan",0285-785133
3326038, RS Umum Daerah Kajen Kab.Pekalongan,Jl. Raya Karangsari Karanganyar Kab. Pekalongan,0285-385231
3326049, RS Umum Daerah Bendan Kota Pekalongan,"Jl. Sriwijaya No.2,Pekalongan",0285 437222
3327010,RS Umum Daerah Dr. M Ashari Pemalang,"Jl. Gatot Subroto No.41,Pemalang",0284-321614
3327021,RS Umum Santa Maria Pemalang,"Jl. Pemuda No. 24,Pemalang",0284-321251
3327032,RS Umum Islam Moga,"Jl. Raya Moga-Pulosari km.02 ,Pemalang",(0284) 583410
3327043,RS Umum Islam Al-Ikhlas,Jl. Kolonel Soegiono NO. 13 Taman,0284-325318
3328055,RSU Islam PKU Muhammadiyah,"Jl. Singkil Km.0,5 Adiwerna, Kab.Tegal",0283-3448131
3329012,RS Umum Daerah Brebes,"Jl. Jend.Sudirman No.181, Brebes",0283-671431
3329045,RS Umum Siti Asiyah,"Jl. Pasar Wage, Bumiayu, Brebes",0289-432352
3329056,RS Umum Muhammadiyah Siti Aminah,Jl. P. Diponegoro Desa Jatisawit Kecamatan Bumiayu Kabupaten Brebes,(0289)432209
3329067, RS Umum Dedy Jaya,"Jl. Ahmad Yani No.57,Brebes",0283-672145
3329078,RS Umum Bhakti Asih,"Jl. P. Diponegoro No.125, Pesantunan Brebes",0283-673481
3371014,RS Umum Daerah Tidar,"Jl. Tidar No.30 A, Magelang",0293-362260
3371025, RS Umum Tk II Dr. Soedjono,"Jl. Urip Sumoharjo 48, Magelang",0293-362813
3371040,RS Jiwa Prof. Dr. Soerojo,Jl. Jenderal Ahmad Yani 169 Magelang,0293-363601
3371084, RS Umum Lestari Raharja,"Jl. Sutopo No.5,Magelang",0293-362225
3371105, RS Ibu dan Anak Gladiool,"Jl. Kenanga No.4-6,Magelang",0293 362702
3371131,RS Umum Harapan,"Jl. Senopati No.11,Magelang",364033
3371142,RS Umum Islam Magelang,"Jl. Jeruk No.4 A , Sanden, Kota Magelang",(0293) 368950
3372015,RS Umum Daerah Dr. Moewardi Surakarta,"Jl. Kol Sutarto 132,Surakarta",0271-634634
3372026,RS Umum Dr. Oen,"Jl. Brigjend Katamso 55,Surakarta",0271-643139
3372030, RS Umum Tk IV Slamet Riyadi Surakarta,"Jl. Slamet Riyadi 321,Surakarta",0271-714656
3372041,RS Umum Brayat Minulya,Jl. Dr. Setiabudi No. 106 Surakarta,0271-716646
3372052,RS Jiwa Daerah Surakarta,"Jl. K.H. Dewantoro 80, Jebres, Surakarta",0271-641442
3372063,RS Orthopedi Prof. Dr. R. Soeharso,"Jl. Jenderal Ahmad Yani Pabelan, Surakarta 57162",0271-714458
3372074, RS Umum Panti Waluyo,Jl. Jend A Yani No.1,0271-712077
3372096,RS Umum PKU Muhammadiyah Surakarta,"Jl. Ronggowarsito 130, Surakarta",0271-714578
3372132,RS Umum Islam Kustati,Jl. Kapt. Mulyadi No.249,0271-643013
3372165, RS Umum Kasih Ibu,"Jl. Slamet Riyadi 404,Surakarta",0271714422
3372191,RS Umum Triharsi,"Jl. Monginsidi No.82,Surakarta",0271-656903
3372234, RS Umum Daerah Kota Surakarta,"Jln. Lettu Sumarto No. 1 Kelurahan Kadipiro, Kecamatan Banjarsari, Kota Surakarta",0271-715300
3373016,RS Umum Daerah Salatiga,"Jl. Osamaliki No.19,Salatiga",0298-324074
3373020,RS Umum Tk. IV 04.07.03 dr. Asmir,Jl. Dr Muwardi No. 50 Salatiga,(0298)326045
3373042,RS Paru Dr. Ario Wirawan,"Jl. Hasanudin No.806,Salatiga",0298-326130
3373090,RS Umum Puri Asih,"Jl. Sudirman No.169,Salatiga",0298-323209
3374010,RS Umum Pusat Dr. Kariadi,"Jl. Dr. Soetomo No.16,Semarang",024-8413993
3374021,RS Umum St. Elisabeth Semarang,"Jl. Kawi No.1,Semarang",024-8310076
3374032,RS Umum William Booth,"Jl. LetJen. S. Parman No. 5, Semarang",024-8411800
3374043,RS Umum Telogorejo Semarang,Jl. KH. Ahmad Dahlan Semarang,024-8446000
3374065, RS Umum Tk.III Bhakti Wira Tamtama Smg,"Jl. Dr. Sutomo No.17, Semarang",024-3555944
3374076,RS Umum Sultan Agung Semarang,"Jl. Raya Kaligawe Km.4,Semarang",024-6580019
3374080, RS Umum Roemani Muhammadiyah,"Jl. Wonodri 2 No. 22,Semarang",024-8444623
3374112, RS Umum Panti Wilasa Citarum,Jl. Citarum No 98 Semarang,(024) 3542224
3374123,RS Jiwa Daerah  Dr. Amino Gondohutomo,"Jl. Brigjen Sudiarto No. 347, Pedurungan, Kota Semarang",024-6722564
3374134,RS Umum Daerah Tugurejo Semarang,"Jl. WALISONGO KM 8,5 NO 137  Semarang",024-7605378
3374145,RS Umum Hermina Pandanaran,"Jl. Pandanaran No.24,Semarang",0248442525
3374203,RS Umum Bhayangkara Akpol Semarang ,Jl. Sultan Agung Candi Baru Komplek AKPOL,(024) 8502766
3374240,RS Panti Wilasa ,"Jl. Dr. Cipto 50, Bugangan, Semarang Timur",024-3546040
3374273, RS Ibu dan Anak Anugerah,"Jl. Kalisari Baru No.5-7,Semarang",024-8313543
3374284, RS Ibu dan Anak Bunda Semarang,Jl. Brigjen Katamso No. 8,024-8413060
3374316, RS Ibu dan Anak Gunung Sawo,"Jl. Gunung Sawo No.21,Semarang",8315171
3374331,RS Umum Banyumanik,"Jl. Bina Remaja Srondol No.61,Semarang",024-7471519
3374342, RS Umum Daerah K.R.M.T Wongsonegoro,Jl. Fatmawati Raya No.1,024-6711500
3374353, RS Ibu dan Anak Kusuma Pradja,"Jl. Bugangan Raya No.3 - 5,Semarang",3546355
3326011,RS Umum Daerah Kraton Kab. Pekalongan,"Jl. Veteran 31,Pekalongan",0285-421621
3375022,RS Umum Budi Rahayu,Jl. Barito No. 5 Pekalongan,0285-423491
3375033,RS Umum Siti Khodijah,"Jl. Bandung No.39-47,Pekalongan",0285422845
3375071,RS Umum Karomah Holistic,"Jl. Gajah Mada Barat No.124,Pekalongan",0285 420218
3376012, RS Umum Daerah Kardinah ,"Jl. KS Tubun No.2, Kota Tegal",0283-350377
3376023,RS Umum  Mitra Siaga,Jl. Pala Raya No.54 Tegal,0283-322550
3376034, RS Umum Tk.IV Tegal,Jl. RS DKT PAGONGAN TEGAL,0283351420
3376082,RS Umum Islam Harapan Anda,"Jl. Ababil No.42,Tegal",0283-358244
3376093, RS Ibu dan Anak Kasih Ibu Tegal,"Jl. Sultan Agung 32,Tegal",(0283) 355525
3401015,RS Umum Daerah Wates,Jl Tentara Pelajar Km.1 No.5 Wates Kulon Progo,0274-773169
3401026,RS Umum St Yusup Boro,Boro Banjarasri Kalibawang Kulon Progo,08112954885
3401037,RS Umum Rizki Amalia Medika,Jl raya Brosot - Wates Km.5 Jogahan Bumirejo Lendah Kulon Progo,085100494522
3402016,RS Umum Daerah Panembahan Senopati,Jl Dr. Wahidin Sudiro Husodo Bantul,0274 367381
3402020,RS Umum Santa Elisabeth,Ganjuran Sumbermulyo Bambanglipuro,0274-367502
3402031,RSU PKU Muhammadiyah Bantul,Jl Jenderal Sudirman 124 Bantul,0274-368238
3402042,RS Ibu Anak Ummi Khasanah,Jl Pemuda Ds Gandekan Bantul,0274367638
3402053,RS Umum Nur Hidayah,"Jl Imogiri Timur Km. 11,5 Trimulyo Jetis Bantul",085 100 472 941
3403010,RS Umum Daerah Wonosari,Jl Taman Bakti No. 06 Wonosari,0274-391007
3403021,RS Umum Nur Rohmah,"Jl Wonosari - Yogya Km. 7, Bandung, Playen, Gunungkidul",0274 394574
3404011,RS Umum Daerah Sleman,"Jl Bhayangkara 48 Triharjo Sleman Daerah Istimewa Yogyakarta, 55514",0274-868437
3404022,RS Jiwa Grhasia,Jl. Kaliurang Km. 17 Pakem Sleman DIY,0274-895143
3404033,RS Umum Panti Baktiningsih,"Klepu Sendangmulyo Minggir, Sleman",0274-6497209
3404070,RSK Bedah An-Nur,Jl. Colombo No. 14-16 Sleman Yogyakarta,0274585848
3404102,RS Umum Panti Rini,"Jl Solo Km 12,5 Krajan Tirtomartani Kalasan Sleman Yogyakarta",(0274)496022
3404124,RS Umum Panti Nugroho,"Jl. Kaliurang  Km.17 Pakem,Sleman",0274897231
3404135,RS Umum Dharma,"Jl Yogya-Wonosari KM. 8,5 Sleman Yogya",0274 444333
3404146,RS Islam Yayasan PDHI,"Jl Solo Km 12,5 Kalasan Yogyakarta",0274-498000
3404157,RS Umum Sakina Idaman,"Jl Nyi Condrolukito, Blunyah Gede 60, Sinduadi, Mlati, Sleman",0274-582039
3404015,RSUP Dr. Sardjito,Jl Kesehatan No.1 Sekip Yogyakarta,0274-587333
3471026,RS Islam Hidayatullah Yogyakarta,Jl Veteran No.184 Pandeyan Umbulharjo Yogyakarta,0274-389194
3471030,RS Tk. III 04.06.03 Dr. Soetarto,Jl Juwadi 19 Kotabaru Yogyakarta,(0274)555402
3471041,RS PKU Muhammadiyah Yogyakarta,Jl K.H. Ahmad Dahlan No. 20 Ngupasan Gondomanan Yogyakarta,0274-512653
3471052, RS Umum Panti Rapih,Jl. Cik Di Tiro 30 Yogyakarta,0274-514845
3471063,RS Bethesda Yogyakarta,Jl Jend. Sudirman No. 70 Kotabaru Yogyakarta,0274 586688
3471074,RSPAU Dr.  Suhardi Harjolukito,Jl. Raya Janti Blok O Yogyakarta,0274 444715
3471085,RS Khusus Jiwa Puri Nirmala,Jl Jayaningprangan No.13 Gunungketur Pakualaman Yogyakarta,515255
3471096,RS  Mata Dr. Yap,Jl Cik Di Tiro No. 5 Yogyakarta,0274-562054
3471223, RSU Bedah Patmasuri,Jln. KH. Ali Maksum Lapangan Krapyak Panggungharjo Sewon Bantul Yogyakarta,(0274) 372021
3471234,RS Umum Daerah Kota Yogyakarta,Jl Wirosaban No. 1 Yogyakarta,0274-371195
3471256,RS Khusus Ibu dan Anak Bhakti Ibu,Jl. Golo No.20 Yogyakarta,
3471282,RS Ludira Husada Tama,"Jl Wiratama 4 Tegalrejo, Yogyakarta","620091,620333"
3471293,RSK THT Sari Asih,Jl. Tirtodipuran No. 38 Yogya,387664
3471303,RS Khusus Ibu dan Anak 45 Prof. Dr. Ismangoen,Jl Patangpuluhan No. 35 Yogyakarta,0274376962
3471314,RSK THT Prof R Oepomo,Jl. Suryomentaraman 298 A Yogya,
3471325,RS Khusus Ibu dan Anak Permata Bunda,Jl Ngeksigondo No 56 Yogyakarta,0274-376092
3471336,RS Bethesda Lempuyangwangi,Jl Hayam Wuruk No.6 Yogyakarta,(0274) 588002
3471362,RS Khusus Gigi Mulut Prof. Soedomo FKG UGM,Jl. Sekip Utara Yogyakarta,0274-555312
3471373,RS Happy Land Medical Centre,Jl Ipda Tut Harsono No.53 Timoho Yogyakarta,0274-550060
3501016,RS Umum Daerah  dr. Darsono,Jl. Ahmad Yani 51 Pacitan,0357-881410
3502010,RS Umum Daerah Dr. Harjono S. Kabupaten Ponorogo,Jl. Raya Ponorogo-Pacitan Kel. Pakunden Kab. Ponorogo,0352-489262
3502112,RS Umum Aisyiyah Ponorogo,"Jl. Dr Sutomo 18 - 24, Ponorogo",0352-461560
3502123,RS Umum Darmayu Ponorogo,Jl. Dr. Sutomo No. 44 Ponorogo,(0352) 481320
3502134,RS Umum Muhammadiyah Ponorogo,Jl. Diponegoro No. 50 Ponorogo,0352 481273
3502145,RS Griya Waluya,Jl. Sultan Agung Nomor 68 Ponorogo,0352 481483
3503011,RS Umum Daerah dr. Soedomo Trenggalek,Jl. dr Sutomo Nomor 2 Trenggalek,0355-793110
3503022,RS Umum Budi Asih Trenggalek,Jl. Mayjen Sungkono Nomor 80 Trenggalek,0355794690
3504012,RS Umum Daerah Dr. Iskak Tulungagung,Jl. Dr. Wahidin Sudiro Husodo Tulungagung,0355-322609
3504045,RS Umum Islam Orpeha,Jl. KH. R. Abdul Fatah Batangsaren Kec. Kauman Kab. Tulungagung,0355 323186
3505013,RS Umum Daerah Ngudi Waluyo Wlingi,Jl. Dr. Sucipto No. 5 Wlingi,0342-691006
3506014,RS Umum Daerah Kabupaten Kediri,Jl. Pahlawan Kusuma Bangsa No. 1 Pare,0354-391718
3506025,RS Toelongredjo,"Jl. A Yani No. 25 Desa Tulungrejo, Kec. Pare, Kab. Kediri",(0354) 391047 /
3506036,RS Umum Amelia,Jl. Pahlawan No. 25A Pare Kediri,0354-394118
3507015, RS Bala Keselamatan Bokor,"Jl. A.Yani 91 Turen , Kab.Malang",0341-824453
3507026,RS Jiwa Dr. Radjiman Wediodiningrat Lawang,"Jl. A. Yani, Lawang, Malang, Jawa Timur",0341-429067
3579030,RS Umum Karsa Husada Kota Batu ,Jl. A.Yani No.10-13 Kota Batu,0341-596898
3507052,RS Umum Daerah Kanjuruhan Kepanjen,"Jl. Panji No. 100 Kepanjen, Kab. Malang",0341-395041
3579074,RS Baptis Batu,Jln. Raya Panglima Sudirman No. 33 Desa Tlekung Kec. Junrejo Kota Batu,(0341)594161
3508016,RS Daerah Dr. Haryoto Kabupaten Lumajang,"Jl. Basuki Rahmat No.5, Lumajang",0334-881666
3508053,RS Wijaya Kusuma,Jl. A. Yani No.149 Lumajang,0334-89410
3509010,RS Umum Daerah Dr. Soebandi,"Jl. Dr. Soebandi No.124, Jember",0331-487441
3509021,RS Perkebunan PTPN X (Persero) Jember,Jl. Bedadung No.2,0331-487104
3509032, RS Tk.III Baladhika Husada Jember,Jl. PB Sudirman No. 45 Jember,0331-484674
3509043,RS Paru Jember,Jl. Nusa Indah No. 28 Jember,0331-411781
3509101,RS Utama Husada Jember,"Jl. Manggar No.134 Tegalsari, Ambulu Jember",0336- 881187
3509112,RS Gigi dan Mulut Fakultas Kedokteran Gigi Jember,Jl. Kalimantan No. 37 Jember,(0331) 325401
3509123, RS Daerah Kalisat Jember,Jl. M.H.Thamrin No.31 Kalisat Jember,0331-591038
3509134, RS Daerah Balung Jember,"Jl. Rambipuji nomor 19, Balung Jember",0336-621595
3510010,RS Umum Daerah Blambangan,Jl. Letkol Istiqlah No. 49 Banyuwangi,0333-421118
3510021,RS Umum Bhakti Husada,Jl. Gajahmada No. 15 Jember,0333-821118
3510043, RS Umum Daerah Genteng,"Jl. Hasanudin No.98, Genteng, Banyuwangi",0333-845839
3510054,RS Islam Fatimah,"Jl. Jember nomor 25, Kelurahan Kalirejo, Kab. Banyuwangi",(0333) 425559
3510076,RS Yasmin,Jl. Letkol Istiqlah Nomor 80-84 Banyuwangi,0333-424671
3510091,  RS Islam Banyuwangi,Jl. Basuki Rachmat No. 129 Banyuwangi,0333-424118
3510102,RS Nahdlatul Ulama Banyuwangi,"Jl. Raya Mangir No. 9, Kec. Rogojampi, Banyuwangi",0333 632965
3511011,RS Umum dr. H.Koesnadi Bondowoso,Jl. Piere Tendean No. 3 Bondowoso,0332-421263
3512012, RS Umum Daerah dr. Abdoer Rahem Kabupaten Situbon,"Jl. Anggrek No. 68, Kel. Patokan, Kec. Situbondo, Kab. Situbondo",0338-671028
3513013,RS Umum Daerah Waluyo Jati Kraksaan,Jl. Dr. Soetomo No. 1 Kec. Kraksaan Kab. Probolinggo,0335-841160
3513024,RS Graha Sehat,Jl. Raya Panglima Sudirman No.2 B Kraksaan,0335-846500
3514025,RS Islam Masyithoh Bangil,Jl. A. Yani No. 6 Bangil- Kab. Pasuruan,0343-741018
3514036,RS Umum Daerah Bangil,Jl. Raya Raci - Bangil Kab. Pasuruan,0343-744900
3515015,RS Umum Daerah Sidoarjo,Jalan Mojopahit No. 667 Sidoarjo,031-8961649
3515026, RSU Siti Khodijah Muhammadiyah Cabang Sepanja,Jl. Pahlawan No .260 Sepanjang Sidoarjo,031-7882123
3515030,RS Umum  Pusdik Polri Porong ,JL. RAYA PORONG NO. 1 SIDOARJO,0343-852104
3515096,RS Umum Delta Surya,Jl. Pahlawan No 09 Sidoarjo,8962531
3515106,RS Islam Siti Hajar Sidoarjo,Jl. Raden Patah No. 70-72 Sidoarjo,031-8921233
3515110, RS Umum Jasem,Jl. Samanhudi No.85 A Sidoarjo,(031) 8962129
3516016,RS Umum Sumberglagah Mojokerto,Dsn. Sumberglagah Ds. Tanjungkenongo Kec. Pacet Mojokerto,0321690441
3516020,RS Umum Daerah Prof. Dr. Soekandar,Jl. Hayam Wuruk 25 Mojosari Kab. Mojokerto,0321-591591
3517010,RS Umum Daerah Kab. Jombang,"Jl. KH.W Hasyim 52, Jombang",0321-863502
3517021,RS Kristen Mojowarno,"Jl. Merdeka No.59 Mojowarno, Jombang",0321-495093
3517043,RS Ibu dan Anak Muslimat Jombang,Jl. Urip Sumohardjo No 34 Jombang,0321-872200
3517076,RS Umum Islam Jombang,Jl. Brig. Kretarto 22 A Jombang,0321-860074
3518011,RS Umum Daerah Nganjuk,"Jl. Dr. Sutomo 62, Nganjuk",0358-321818
3518022,RS Umum Daerah Kertosono,Jl. Panglima Sudirman No.16 Kertosono.,0358-5501604
3518033,RS Sumber Waras,Jl. Langsep No. 3 Desa Pelem RT 01 RW 07 Kec. Kertosono Kab. Nganjuk,556006
3519012,RS Paru Dungus,"Jl. Raya Dungus - Wungu, Madiun",0351 456735
3519023,RS Umum Daerah Caruban,Jl. A. Yani KM 2 Caruban Madiun,0351-383956
3520012,RS Umum Daerah dr. Sayidiman Magetan,Jl. Pahlawan No.2 Magetan,0351-895023
3521013,RS Umum Daerah Dr. Soeroto Ngawi,Jl. Dr Wahidin no: 27,0351-749023
3522014,RS Umum Daerah Dr. R. Sosodoro Djatikoesoemo,"Jl. Veteran No 36, Bojonegoro",0353-3412133
3522025,RS Umum Aisyiyah Bojonegoro,Jl. Hasyim Asyari 17 Bojonegoro,0353881748
3522036,RS Umum Muhamadiyah Sumberejo,Jl. Raya Sumberrejo 1193 Bojonegoro,331056
3522047,RS Umum Daerah Sumberrejo,"Jl. Raya No. 231 Sumberrejo, Bojonegoro",0353-331530
3522058,RS umum Daerah Padangan,"Jl. Dr. Soetomo No. 2 Padangan, Bojonegoro",(0353) 551666
3523015,RS Umum Daerah Dr. R. Koesma Tuban,Jl. dr. Wahidin Sudiro Husodo No. 800,0356-321010
3523041,RS Medika Mulia Tuban,Jl. Mojopahit 699 Tuban,(0356) 324618
3523052,RS Muhammadiyah Tuban,Jl. Diponegoro No.1 Tuban,"0356 321334,"
3524016,RS Umum Daerah Dr. Soegiri Lamongan,Jl. Kusuma Bangsa No. 7 Lamongan,0322-321718
3524020,RS Islam Nashrul Ummah,"Jl. Merpati No.62, Lamongan",0322 321522
3525010,RS Umum Daerah Ibnu Sina Kab. Gresik,Jl. Dr. Wahidin Sudirohusodo No. 243B Gresik,031-3951239
3525021,RS Semen Gresik,"Jl. R A Kartini No. 280 Kel. Tlogopatut Kec. Gresik, Kab. Gresik",031-3987840
3525043,RS Ibu dan Anak Nyai Ageng Pinatih Gresik,Jl. KH Abdul Karim 76-78 Gresik,(031)3981167
3525076,RS Petrokimia Gresik,"Jl. Jend. A. Yani No. 69 Kel. Ngipik, Kec. Ngipik, Kab. Gresik",(031)3978658
3525087,RS Denisa,Jl. Dr. Wahidin Sudirohusodo No.736,031-3950552
3526011,RS Umum Daerah Syarifah Ambami Rato Ebu,Jl. Pemuda Kaffa No. 9 Bangkalan,3091111
3527012,RS Umum Daerah Kab. Sampang,"Jl. Rajawali No. 10, Sampang",0323-323956
3528013,RS Umum Daerah Dr. H. Slamet Martodirdjo Pamekasan,"Jl. Raya Panglegur No.4, Pamekasan",0324-326242
3528024,RS Umum Larasati Pamekasan,Jl. Mandilaras No.74-80 Pamekasan,0324 3283505
3529014,RS Umum Daerah dr. H. Moh. Anwar ,Jl. Dr Cipto No. 42 Desa Kolor Kab. Sumenep,0328-662494
3529025,RS Islam Garam Kalianget,"Jl. Raya Kalianget No.1, Kab Sumenep",0328-667433
3571016,RS Umum Daerah Gambiran,Jl. KH. Wakhid Hasyim No. 64 Kota Kediri,0354-774494
3571020,RS TK. IV 05.07.02 Kediri,"Jl. Mayjen Sungkono No. 44, Kota Kediri",0354-687801
3571031,RS Umum Bhayangkara Kediri,Jl. Kombes Pol Duryat 17 Kediri,(0354) 671100
3571042,RS Baptis Kediri,Jl. Brigjen Pol IBH Pranoto No. 1-7 Kota Kediri,"684172, 682170"
3571053,RS Umum Daha Husada,"Jl. Veteran No. 48, Kediri",0354-771062
3571111,RS Ibu dan Anak Nirmala Kediri,Jl. Jaksa Agung Suprapto No. 5 Kediri,0354772963
3571122,RS Muhammadiyah Ahmad Dahlan,Jl. Gatot Subroto No. 84 Kediri,(0354) 773115
3572010,RS Umum Daerah Mardi Waluyo,"Jl. Kalimantan 113, Kota Blitar",0342-802118
3572021,RS Katolik Budi Rahayu,Jl. Jend. A. Yani 18 Kota Blitar,0342-801066
3572043,RS Umum Syuhada Haji,Jl. Tanjung No.12 Pakunden-Blitar,801607
3505054,RS Umum An-Nisaa,"Jl. Suparyono Timur No. 1, Bajang Talun Blitar",0342-692999
3573011,RS Umum Daerah Dr. Saiful Anwar,Jl. Jaksa Agung Suprapto No.2 Malang,0341-362101
3573022,RS Tk. II Dr. Soepraoen,Jl. Soedanco Supriyadi No. 22 Kota Malang,0341-325111
3573044,RS Umum Panti Nirmala,"Jl. Kebalen Wetan N0.2-8 Kedung Kandang, Kota Malang",362459
3573055,RS Umum Panti Waluya Sawahan Malang,Jl. Nusakambangan No.56 Kota Malang,0341-362017
3573066,RS Umum Lavalette Malang,Jl. WR. Supratman No.10 Kota Malang,482612
3507070, RS Marsudi Waluyo,"Jl. Raya Mondoroko Km. 09, RT 004 RW 003 Desa Purwoasri, Kec. Singosari, Kab. Malang",458974
3573135,RS Ibu dan Anak Muhammadiyah Malang,Jl. KH. Wahid Hasyim NO. 30 Malang,0341-326222
3507204,RS Umum Islam Gondang Legi,"Jl. Hayam Wuruk 66, Gondang Legi Wetan, Kab. Malang",879047 - 879879
3573215,RSU Islam Aisyiyah Malang,Jl. Sulawesi No 16 Malang,0341-326773
3573226,RS Islam Malang,Jl. MT. Haryono No. 139 Malang,(0341) 551356
3507230,RS Sumber Sentosa,"Jl. Kebonsari No. 221 Malang, RT 003, RW 002 Desa Tumpang, Kec. Tumpang, Kab. Malang",0341787233
3507241, RS Umum Islam Madinah Kasembon,"Jl. Raya Sukosari No.32, Kasembon, Kabupaten  Malang",0354 326688
3574012,RS Umum Daerah dr. Mohamad Saleh Kota Probolinggo,Jl. Mayjend Panjaitan No.65 Kota Probolinggo,0335-433119
3574023,RS Umum Dharma Husada,Jl. Sukarno Hatta No. 10 Kota Probolinggo,422177
3575013,RS Umum Daerah Dr. R. Soedarsono Kota Pasuruan,Jl. Dr Wahidin Sudirohusodo No. 1-4 Kota Pasuruan,(0343) 421073
3576014,RS Umum Dr. Wahidin Sudiro Husodo Kota Mojokerto,"Jl. Raya Surodinawan Kel. Surodinawan, Kec. Prajurit Kulon, Kota Mojokerto",0321-322194
3576040,RS Reksa Waluya,"Jl. Mojopahit 422, Kel. Miji, Kec. Prajurit Kulon, Kota Mojokerto",0321.322170
3576051,RS Islam Hasanah Muhammadiyah ,"Jl. HOS Cokroaminoto No. 26-28, Kel. Jagalan, Kec. Magersari, Kota Mojokerto",0321-321635
3516062,RS Islam Sakinah,"Jl. RA Basuni No.12, Kec. Sooko, Kab. Mojokerto",321922
3516073,RS Umum Daerah Raden Achmad Basoeni,"Jl. Raya Gedeg No.17, Kec. Gedeg, Kab.Mojokerto",(0321) 364752
3577015,RS Umum Daerah Dr. Soedono Madiun,"Jl. Dr. Soetomo 59, Madiun",0351-454657
3577026,RS Umum Santa Clara,"Jl. Biliton No. 15  Kel.Madiun Lor, Kec.Mangunharjo, Kota Madiun",0351-462688
3577030,RS Umum TNI AD Tk. IV 05.04.01 Kota Madiun,Jl. Pahlawan No. 79 Kartoharjo Madiun,0351-454787
3577074,RS Umum Islam Siti Aisyah,"Jl. Mayjen SungkoNo. 38 Kel. Nambangan Lor, kec. Mangunharjo, Kota Madiun",0351-464822
3577085,RS Umum Daerah Kota Madiun,Jl. Campursari No.12B Madiun,0351-481314
3578016,RS Umum Daerah Dr. Soetomo,"Jl. Mayjend. Prof. Dr. Moestopo No. 6 - 8 Surabaya, Jawa Timur",031-5501001
3578020,RS dr. Ramelan,Jl. Gadung No. 1 Surabaya,031-8438153
3578031,RS William Booth Surabaya,"Jl. Diponegoro 34, Surabaya",031.5678917
3578042,RS Umum Katholik Surabaya,"Jl. Diponegoro 51,Surabaya",031-5677562
3578053,RS Darmo,"Jl. Raya Darmo 90,Surabaya",031-5676253
3578064,RS Adi Husada Undaan,"Jl. Undaan Wetan No. 40-44, Surabaya",031-5318000
3578086,RS Primasatya Husada Citra (PHC) Surabaya,Jl. Prapat Kurung Selatan no 1 Tanjung Perak Surabaya,031-3294801-3
3578090,RS TNI AL Dr. Oepomo,Jl. Laksda M.Nazir No.56 Surabaya,031-3293536
3578100,RS Umum Adi Husada Kapasari,Jl. Kapasari No. 97-101 Surabaya,031-3764555
3578111,RS Islam Surabaya,Jl. Jend A Yani 2-4 Surabaya,031-8284505
